title,score,id,url,comms_num,created,body,timestamp
"Study: Sleeping on your side helps the brain clear toxins during sleep, including amyloid plaque (associated with Alzheimers/dementia). This is part of the recentlty discovered glymphatic system in the brain.",607,8zzcx6,https://www.reddit.com/r/Nootropics/comments/8zzcx6/study_sleeping_on_your_side_helps_the_brain_clear/,99,1531976219.0,"https://americanpostureinstitute.com/proper-sleeping-posture-for-brain-drain/

>The glymphatic pathway [in the brain] expedites clearance of waste, including soluble amyloid(A) to prevent amyloid plaques from accumulating in the brain. Researchers have shown that patients suffering from chronic impairment of glymphatic pathway function due to traumatic brain injury are vulnerable to tau aggregation and the onset of neurodegeneration. These patients have an increased chance of developing dementia and Alzheimer’s Disease (Iliff et al., 2014).

>**Put simply, the glymphatic system eliminates brain waste to prevent diseases of the central nervous system such as dementia.**

>Sleep Posture and the Glymphatic System

>Transport through this pathway is controlled by the brain’s arousal level, making sleep hygiene important to the glymphatic system. During sleep the brain’s interstitial space volume expands compared to its size during wakefulness or arousal. Increased interstitial space with sleep results in faster waste removal.

>Humans exhibit different body postures during sleep, which may also affect waste removal. Therefore, not only the level of consciousness, but also body posture, might affect CSF–interstitial fluid (ISF) exchange efficiency throughout the night.

>**Researchers confirmed that glymphatic transport and clearance was superior in the lateral and supine sleeping positions.** The researchers proposed that sleeping on your side has evolved to optimize waste removal during sleep and that posture is considered ideal for glymphatic transport.

>The lateral sleeping position is also advantageous for your posture. To optimize ‘Brain Drain’ and to prevent musculoskeletal pain, consider the importance of your sleeping posture. Sleeping on your side with a small pillow between your legs is considered the ideal sleeping position.",2018-07-19 00:56:59
Study Links Fluoridated Water During Pregnancy to Lower IQs,592,csq23l,https://www.thedailybeast.com/fluoridated-water-during-pregnancy-linked-to-lower-iqs-study-published-by-jama-pediatrics-says,260,1566289419.0,,2019-08-20 04:23:39
"Vitamin D deficiency weakens dopamine system, leading to overeating and obesity - Calcitriol (active Vitamin D) Upregulates Dopamine D2 receptors, Increases Dopamine Production (↑ Tyrosine Hydroxylase [↑TH]) [mice] (2016)",579,g96z4k,https://www.ncbi.nlm.nih.gov/pmc/articles/PMC4875352/,94,1588042773.0,,2020-04-27 22:59:33
"Good morning. As a 65 year old, I took a so called Nootropic for the first time. I feel like I'm young again!",571,cunk0h,https://www.reddit.com/r/Nootropics/comments/cunk0h/good_morning_as_a_65_year_old_i_took_a_so_called/,195,1566641542.0,"I am so grateful I learned how to use the internet last year. Its a treasure trove of information!

I had been looking for something to revitalise myself as someone in retirement. I came across something called modafinil and I asked my nephew if he knew anything about it. He actually used it him self and gave me some.

I took it a few hours ago and I feel like I do in the 80s ha ha! This stuff is crazy. I have done so much today and I feel so active and motivated like I did many decades ago. God bless everyone",2019-08-24 06:12:22
"An unexpected source of common cognitive impairment: atmospheric CO2. Humans evolved in air with about 300ppm CO2. Today, in urban areas, 500ppm is common OUTDOORS. Operating ~1000ppm results in ~15% cognitive decline. 1400ppm is 50% cognitive decline. These numbers are common in offices.",573,aikqh1,https://www.youtube.com/watch?v=1Nh_vxpycEA,93,1548173376.0,,2019-01-22 11:09:36
My nootropics/supplement collection is getting slightly out of hand,560,9gfh4d,https://i.redd.it/4u4jz1fcwom11.jpg,237,1537171391.0,,2018-09-17 04:03:11
Why Your Nootropics Arent Working,564,dir6b1,https://www.reddit.com/r/Nootropics/comments/dir6b1/why_your_nootropics_arent_working/,186,1571269766.0,"I dove into noots about 10 years ago, around the time Dave Asprey was coming out of hiding and Modafanil was starting to get popular traction. I got involved because like everyone else here, I wanted to perform better in all areas of my life, especially my work, which is very technically obtuse and demanding. I took these compounds very seriously, and they have vastly improved my life.

Along the way I realized a few critical elements that caused ""non response"" to certain doses and compounds. Ive also read far too many accounts here on reddit and other  biohacking forums of people saying things like ""its a placebo"" or, ""This stuff doesn't work"".  If you're experiencing shitty results, id like to offer a few of my observations as to why:

1. ***Your Baseline sucks. -*** If you havent changed the oil in your car in over a year, neglected all your filters, drive on bald tires and generally avoid any maintenance, will a brand new performance exhaust and the most expensive racing fuel make your driving experience any better? If you want performance enhancement drugs to have an impact on your performance, you better make sure the basics are in order - Sleep, Reasonable Nutrition, Hydration and a host of other fundamental elements need to be tight if you want to step up your game with Nootropics. Your brain/body cant use energy systems you've been trashing with Mcdonalds and Vodka for a week.
2. ***You think Noots are NZT-like super drugs -*** This is the most common explanation for why people say ""X compound doesn't work"". No drug on the planet is going to motivate you to put the PlayStation controller down and do what you're supposed to be doing to elevate your life Game. YOU have to cultivate your own motivation to do what your laziness is currently keeping you from doing, and smart drugs will assist you once you get there. If your looking for a drug to ""make you do it"", Nootropics will always leave you disappointed. Take some initiative bro. There is no magic bullet, just bigger and better guns. 'still have to learn to shoot.
3. ***Youre not self-experimenting properly -*** There are about 30 compounds I can think of that will have a profound effect on your performance. Which of those is right for you and what doses can only be answered by one person: YOU. Theres no way a 275lb Bodybuilder with an I.Q. of 30 who sleeps 10 Hrs is going to have the same experience as a 19 y/o weakling studying for the BAR exam who sleeps 4H,  but for some reason, the biohacking community tends to lump these two together in terms of chemical reactions.Do legitimate self-experimental cycles, *one compound at a time,* for an extended period of time before you jump to a conclusion.
4. ***You're not dosing surgically -*** some compounds are only effective at a certain dose range, and that dose is going to be particular to YOUR body. Stop downing fistfuls of shit because you're ""Experienced with drugs, and have a high tolerance to pills"". Do your research. Separate the Signal from the Noise and understand what these compounds actually do inside you, what they deplete and what the consequences of use are. More is almost never better. Start low, and gradually increase if your self experimentation calls for it.
5. **You dont need chemical enhancement, you need to clean your room. -** When i was a competitive power lifter, I took a shit ton of steroids. Some people may argue with the morality of this, but they are clueless to the fact that its what you have to do if you want to win medals at a professional level in this sport, and compete with straight up bio-mutant humans on the platform.Because of my size and performance, Gym Rats and New-bros would ask me all the time, What should I take and what dose? My response was always this: Chemical Performance enhancement is level 10 shit. If your on level 0, meaning you skip the gym, skip meals, get dehydrated daily, drink out every night and sleep for 5 hours you have no biz taking performance enhancement drugs. You're just lazy and looking for a magic bullet. Earn your right to take things to the next level, stop trying to cheat yourself. Come back when you're level 9.

**TLDR: Your Baseline is fucked. You dont sleep enough, eat shitty foods, treat your body & spirit like trash, and expect a pill to turn you into Elon Musk overnight. Drink more water, consume less carbs and social media, get 30 min of light exercise daily, make your bed everyday and I bet a dollar to a doughnut your Noots will ""work"" better.**",2019-10-16 19:49:26
"Higher aerobic fitness levels decrease the probability of experiencing tip-of-the-tongue states (when you can’t think of a word that’s on the tip of your tongue) in healthy older adults, in the first demonstration of a link between aerobic fitness and language functioning in healthy older adults.",552,f1f0sc,https://www.nature.com/articles/s41598-018-24972-1,55,1581310836.0,,2020-02-10 00:00:36
95% of your serotonin is produced in your gastrointestinal tract -Nutritional psychiatry: Your brain on food - Harvard Health Blog,548,c0obzc,https://www.health.harvard.edu/blog/nutritional-psychiatry-your-brain-on-food-201511168626,101,1560569943.0,,2019-06-14 23:39:03
One night of sleep deprivation causes the accumulation of a protein associated with Alzheimer's Disease progression,539,8b9cr9,http://www.pnas.org/content/early/2018/03/29/1721694115,88,1523409157.0,,2018-04-10 21:12:37
MDMA therapy achieves astounding 76% success rate for treating PTSD,542,9tjx16,https://newatlas.com/mdma-ptsd-successful-trial-results/57074/,40,1541192852.0,,2018-11-02 17:07:32
"Vitamin D determines severity in COVID-19 so government advice needs to change, experts urge: Researchers point to changes in government advice in Wales, England and Scotland",521,gq3shv,https://www.sciencedaily.com/releases/2020/05/200512134426.htm,92,1590407156.0,,2020-05-25 07:45:56
Neuroscience study indicates the narcolepsy drug modafinil enhances cognitive control in healthy people,512,ismgcj,https://www.psypost.org/2020/09/neuroscience-study-indicates-the-narcolepsy-drug-modafinil-enhances-cognitive-control-in-healthy-people-57929,180,1600124255.0,,2020-09-14 18:57:35
"A study of 13,388 women showed fruit is NOT associated with cognitive benefits. However total vegetable intake was significantly associated with brain benefits. Cruciferous vegetables and leafy greens were the most important.",515,ao9nl3,https://www.reddit.com/r/Nootropics/comments/ao9nl3/a_study_of_13388_women_showed_fruit_is_not/,99,1549608167.0,"Ann Neurol. 2005 May;57(5):713-20.

Fruit and vegetable consumption and cognitive decline in aging women.

Kang JH1, Ascherio A, Grodstein F.

Abstract

We prospectively examined fruit and vegetable intake in relation to cognitive function and decline among aging women. Participants were followed from in 1976 with biennial questionnaires, and food frequency questionnaires were administered in 1984, 1986, and every 4 years thereafter. From 1995 to 2001, we administered, by telephone, six cognitive tests measuring general cognition, verbal memory, category fluency, and working memory. We repeated assessments two years later for 13,388 women (>90% follow-up). We averaged dietary intakes from 1984 through the first cognitive assessment, and used linear regression to obtain multivariable-adjusted mean differences in performance and decline in performance across intake levels. **Fruits were not associated with cognition or cognitive decline. However, total vegetable intake was significantly associated with less decline**. Specifically, on a global score combining all tests, women in the highest quintile of **cruciferous vegetables** declined slower (by 0.04 unit; 95% confidence interval, 0.003, 0.07; p trend = 0.1) compared with the lowest quintile. Women consuming the most **green leafy** vegetables also experienced slower decline than women consuming the least amount (by 0.05 unit; 95% confidence interval, 0.02, 0.09; p trend < 0.001). These mean differences were equivalent to those observed for women about 1 to 2 years apart in age.

PMID: 15852398 DOI: 10.1002/ana.20476
",2019-02-08 01:42:47
"Vitamin D Significantly Upregulates the D2 Dopamine Receptor, Increases Dopamine Synthesis, and Potentiates the Effects of Amphetamine in rats (2016)",514,8bjy79,https://www.ncbi.nlm.nih.gov/pmc/articles/PMC4875352/,108,1523504458.0,,2018-04-11 23:40:58
"Tim Ferriss just posted a 2-hour 46-minute podcast (!) where I tackle questions from listeners. Lots of very deep discussion on nootropics, but also this might be THE most in-depth and organized coverage of my general thoughts on lifestyle and health ever!",497,6998fm,http://tim.blog/2017/05/04/smart-drugs-fasting-and-fat-loss/,62,1493950324.0,,2017-05-04 22:12:04
Cerebral Health Pyritinol Test Results (WARNING),494,1mmip9,https://www.reddit.com/r/Nootropics/comments/1mmip9/cerebral_health_pyritinol_test_results_warning/,229,1379510752.0,"Many of you may remember the issue that came up with Cerebral Health/Bioscience Nutraceuticals a few months ago, where their choline bitartrate was numbing people's mouths. After sending those samples in to the lab, the tests came back negative for choline bitartrate. We suspected it was choline salacylate, but decided further testing to ascertain the exact compound would not be worth the cost. Unfortunately that was not the last issue to come from Cerebral Health.

A few weeks ago, another Redditor placed an order pyritinol from CH, along with some alpha GPC and oxiracetam. When the order arrived, both the alpha GPC and oxiracetam seemed alright. However, the pyritinol seemed off. Before thinking about it, he took his normal 400mg dose of pyritinol and went out for a mountain bike ride. Within 15-20 minutes he was getting a weird euphoria and detachment. After another couple minutes, his memory gets very fuzzy. 

Eventually his sister found him in the garage in a manic/psychotic state. He was biting his lips very hard, shaking, and holding his fists tight. Eventually he went into seizures when the paramedics came. He was taken to the hospital and seized again while waiting for the doctor. He had a crazed look in his eyes like what you see with people having a psychotic episode on MDPV. He was in the hospital for 4 days.

Not putting two and two together yet, he tried another small dose of pyritinol a few days after getting home, to see what effects came back. Sure enough, he started to get the euphoria and disassociation that he felt before. He also got the same crazed look in his eyes, and same rolling nystagmus. It tasted nothing like pyritinol, but more like burnt plastic. His cognition was off for a while due to the seizures, but he was sure it was the Cerebral Health pyritinol that caused it.

After doing some searching for similar reactions and physical properties online, he came to the conclusion that the compound was most likely a cathinone derivative like MDPV. All the effects fit with an overdose on something like MDPV. Since 400mg is a normal dose for pyritinol, but a massive dose for MDPV, that is most likely what caused the blackout and seizures. Since then he has been having intermittent seizures, and has been back in the hospital 3 times.

After speaking with the other moderators, we decided we needed to send a sample into the lab to get this tested. To prevent any accusations of tampering with the sample, I had another moderator order a whole new bag from them, then send a sample from that into the lab to be tested. So we now have two samples of the compound in question. The original one that sent the Redditor to the hospital, and the separate order we placed right after we became aware of the issue. Today the results came back, and it tested negative for pyritinol. I spoke to Colin at the lab, and he said that the FTIR did not match up at all, and that it was a completely unrelated compound. Due to legal constraints, the lab did not want to do a full workup on the compound apart from confirming it was not pyritinol. So we are going to be sending another sample from the same batch to Dacesafe.org to do a full workup. It will tell us exactly what the compound is, and what purity level it is at.

[Here is the result from Colmeric](http://i.imgur.com/cCOCMUs.jpg)

So in light of this, I suggest that nobody purchases anything from Cerebral Health. This is the second instance in the last 6 months where they have been selling a completely different substance than what it was advertised as. In this particular instance, it could even be a dangerous and illegal substance. Until we do a full workup, I cannot say for sure if this substance was MDPV or another cathinone derivative. However, it is definitely a psychoactive compound other than pyritinol. Obviously a lawyer is going to be brought in by the Redditor that went to the hospital, so I may have to take certain statements down eventually. However, I want everyone to be aware of this serious issue before it potentially puts another person in the hospital!

**EDIT: After further testing, the substance was identified as diphenhydramine (Benadryl).**

[Here are the spectra results.](http://i.imgur.com/SlHOkou.jpg)",2013-09-18 09:25:52
Alzheimer's memory loss reversed by new head device using Transcranial Stimulation,484,db4fsp,https://www.sciencealert.com/small-trial-reverses-a-year-of-alzheimer-s-in-just-two-months-in-seven-patients,85,1569835891.0,,2019-09-30 05:31:31
"Lmao: ""Start-up makes millions selling 'brain hacking' pills, but its own study found coffee works better""",491,7gpp8y,https://www.cnbc.com/2017/11/30/hvmn-nootrobox-study-smart-pill-less-effective-than-caffeine.html,50,1512105487.0,,2017-12-01 00:18:07
Recruitment for Imperial College microdose study,486,bkdzgl,https://i.redd.it/1w62itt1i2w21.png,74,1556949193.0,,2019-05-04 01:53:13
"When given in a formulation that facilitates passage to the brain, lithium in doses up to 400 times lower than what is currently being prescribed for mood disorders is capable of both halting signs of advanced Alzheimer's pathology and of recovering lost cognitive abilities.",484,eu4yxr,https://www.mcgill.ca/newsroom/channels/news/can-lithium-halt-progression-alzheimers-disease-313496,92,1580062038.0,,2020-01-26 13:07:18
Cannabinoids drive motivation to voluntarily seek aerobic exercise,481,cyr3p1,https://www.psychologytoday.com/us/blog/the-athletes-way/201903/motivation-run-or-not-run-is-linked-cannabinoids,110,1567469931.0,,2019-09-02 20:18:51
"Very specific GNC (I pointed it out and the salesperson said ""nootropic is a brain supplement, I think it's pretty new""",480,edejeu,https://i.redd.it/q5nrssix7u541.jpg,147,1576897908.0,,2019-12-20 22:11:48
Ever wondered why fungi contain compounds that affect human cognition? It's because our unicellular ancestors shared ancient neurotransmitters that pre-dated the evolution of the brain. - Prof. Michael Levin NeurIPS 2018,479,a87nrg,https://reddit.com/r/DrugNerds/comments/a84hb4/ever_wondered_why_fungi_contain_compounds_that/,77,1545406492.0,,2018-12-21 10:34:52
"Joe Rogan's approach to Nootropics is wildly irresponsible, potentially dangerous, and flat out stupid.",470,amrtuv,https://www.reddit.com/r/Nootropics/comments/amrtuv/joe_rogans_approach_to_nootropics_is_wildly/,301,1549244540.0,"Sorry but the way Rogan approaches Nootropics is, IMHO, really really dumb. 

In his latest podcast (with Sinclair which was super interesting) he says he takes 3 different nootropic supps all of which have multiple ingredients. 

One of them is trubrain which is-

>L-theanine, Caffeine, Uridine, Centrophenoxine, Magnesium, Tyrosine, N-Acetyl Carnitine, Citicholine, Monk Fruit, Mangosteen, Nopal Concentrate, Noopept, Cane Sugar, Blue Agave, Purified Water, Xylitol, Nisin, Polylysine.

Okay so now what if you have a negative reaction to that? how on earth would you determine which specific ingredient you reacted to? same with a positive reaction. Its possible only one of those ingredients is helping you and the rest are just doing nothing or actually doing damage to your brain chemistry. You dont know!  

Also there are multiple cholinergic substances in that. Too much of that can fuck you up. 

Now consider he ALSO is taking 2 other nootropic supplement which ALSO have multiple ingredients! This is like 30 - 40 nootropic ingredients this man is sucking down for shits and giggles.

He seems to be following the ""Just take ALL the nootropics ALL the time! More and more! Balls to the Wall! Fuck yeah!"" approach

sorry but that if FUCKING STUPID! You are messing with your brain chemistry and turning your body into a ongoing chemistry experiment. Bad. Wrong. No. Dont do it, dont follow his lead. 

Do ONE nootropic at a time, see how you react and then adjust accordingly. 

Fucking Rogan man. How can he be so smart and so fucking stupid at the same time? 

Sorry for the rant but geez louise, this is how you get an industry over regulated. 



**--------------------EDIT--------------**


ok so he also takes Alpha Brain and nuero1

>L-Tyrosine
L-Theanine
Oat (straw) extract
Vitamin B6
Phosphatidylserine
Cat’s Claw extract
GPC
Bacopa extract
Huperzia Serrata
Huperzine A
L-Leucine
Vinpocetine
Pterostilbene

plus 


>L-Glutamine, Glycine, Taurine, L-Tyrosine, Glucuronolactone, Magnesium Creatine Chelate, Acetyl-L-Carnitine, Piracetam, DL-Phenylalanine, Alpha Glycerylphosphoryl Choline, Inositol, L-Theanine, Alpha Lipoic Acid, Phosphatidylserine (soy), DMAE Bitartrate, Rhodiola Rosea [root] extract, Siberian Ginseng (eleutherococcus senticosus ), Coenzyme Q10, 5-HTP, Bacopa Monniera [whole plant] extract, black pepper extract (Bioperine®), Huperzine Serrata [whole plant] extract, Biotin, Vinpocetine, Ginkgo Biloba [leaves] extract.

------------------------

***So I count 11 separate chemicals that boost acetylcholine levels***. Thats flat out stupid. These chemicals in your brain are supposed to be balanced, not too much not too little. There are multiple systems within your brain designed to regulate this. Taking 11 chemicals designed to wack out your ACH levels is just simply begging to have your brain chemistry fucked up. Unwise. Dont be like Joe, be smart. 



**-----------------EDIT #2---------------------------**

http://mindrenewal.us/page13.html

**Symptoms of High Acetylcholine**

**Subdued or depressed mood Anhedonia (inability to experience pleasure) Difficulty concentrating Difficulty with higher-order or complex thought processes Mental fatigue Mental confusion Memory problems Decreased motivation** Feeling overly sleepy or tired (particularly in the evening), despite adequate sleep and rest Difficulty understanding or performing tasks Pessimistic, negative ideation or rumination Feelings of helplessnes and hopelessness Fretfulness Irritability or anger Emotional heightening and lability Sadness, tearfulness Blurred vision Headache Dry mouth Altered sense of smell; heighted sensitivity to odors; olfactory delusions Stomach pain or discomfort Intestinal gas or bloating Diarrhea or constipation Nausea, dizziness, and vomiting Muscle pain or discomfort Joint pain, discomfort, or swelling Tooth or jaw pain or discomfort Tingling or numbness in arms or legs Muscle weakness Increased urinary frequency or problems with bladder control Flu or cold-like symptoms Weakening of immune system and increased susceptibility to illness Cough Nasal discharge Chills or sensation of cold Cold feet, hands Sleep disturbance Introversion Anxiety More and vivid dreaming, and higher incidence of nightmares Decreased levels in the brain of the neurotransmitters, serotonin, norepinephrine, and dopamine Interference with the release of the above brain transmitters, because of higher inhibition",2019-02-03 20:42:20
