title,score,id,url,comms_num,created,body,timestamp
How to get a scientific paper for free,2613,f2xuxt,https://i.imgur.com/rXCrs9R.jpg,78,1581569438.0,,2020-02-12 23:50:38
This is pretty much the biggest red-alert towards legal nootropics in the US.,1244,8r7ipn,https://www.reddit.com/r/Nootropics/comments/8r7ipn/this_is_pretty_much_the_biggest_redalert_towards/,452,1529058254.0,"So essentially, there’s this bill called Stop the Importation and Trafficking of Synthetic Analogues (SITSA) Act. It gives the DEA and the attorney general almost completely unchecked power to schedule any drug they see fit without following the currently established legal criteria to ban certain substances. In Section 2, Subsection 3B of the bill, this is the most worrying part that affects many different nootropics from phenibut to adrafinil or even kratom or tianepetine. 

“6)Schedule A
(A)In general
The drug or substance—

(i)has—

(I)a chemical structure that is substantially similar to the chemical structure of a controlled substance in schedule I, II, III, IV, or V; and

(II)an actual or predicted stimulant, depressant, or hallucinogenic effect on the central nervous system that is substantially similar to or greater than the stimulant, depressant, or hallucinogenic effect on the central nervous system of a controlled substance in schedule I, II, III, IV, or V; and

(ii)is not—

(I)listed or otherwise included in any other schedule in this section or by regulation of the Attorney General; and

(II)with respect to a particular person, subject to an exemption that is in effect for investigational use, for that person, under section 505 of the Federal Food, Drug, and Cosmetic Act (21 U.S.C. 355) to the extent conduct with respect to such substance is pursuant to such exemption.


(B)Predicted stimulant, depressant, or hallucinogenic effect
For purpose of this paragraph, a predicted stimulant, depressant, or hallucinogenic effect on the central nervous system may be based on—

(i)the chemical structure, structure activity relationships, binding receptor assays, or other relevant scientific information about the substance;

(ii)

(I)the current or relative potential for abuse of the substance; and

(II)the clandestine importation, manufacture, or distribution, or diversion from legitimate channels, of the substance; or

(iii)the capacity of the substance to cause a state of dependence, including physical or psychological dependence that is similar to or greater than that of a controlled substance in schedule I, II, III, IV, or V. “


This is concerning due to Phenibut having a similar pharmaceutical effect to Lyrica (schedule V) nd also being able to be (A) abused, and (B) can cause addiction or dependence similar to benzodiazepines or other GABApentinoids. 

Adrafinil is an analogue of Modafinil, a schedule IV drug, so it’s obvious why that could be banned immediately. 

Here is the link to the whole bill’s information, contact your reps, we need to stop this bill. 

https://www.govtrack.us/congress/bills/115/hr2851/summary


Edit: there’s a letter from Human Rights Watch to Congress concerning this for those interested: 
https://www.hrw.org/news/2018/06/14/opposition-letter-hr-2851-stop-importation-and-trafficking-synthetic-analogues-sitsa
",2018-06-15 06:24:14
"I just learned that 10 minutes of ""wakeful rest"" (doing nothing / no sensory input) after learning was associated with 40% higher memory retrieval a week later. What are some other cognitive-enhancing phenomena everyone should know?",1175,afwze3,https://www.reddit.com/r/Nootropics/comments/afwze3/i_just_learned_that_10_minutes_of_wakeful_rest/,99,1547509296.0,"This is something that's important in a world with constant distraction: [Boosting Long-Term Memory via Wakeful Rest: Intentional Rehearsal Is Not Necessary, Consolidation Is Sufficient
](https://journals.plos.org/plosone/article?id=10.1371/journal.pone.0109542). They gave two groups of people a free recall memory task. One group was then placed in a quiet room with no distractions for 10 minutes afterward, and the other group was given an additional cognitive task for 10 minutes afterward.

>Participants in the high sensory stimulation group completed 10 minutes of a spot-the-difference task, during which they were presented sequentially with 30 picture pairs on a laptop screen [2]. Their task was to identify and point to two differences between each picture pair within a 20-second time limit. Participants were instructed not to talk during the task, and care was taken to ensure that the spot-the-difference task was entirely visual: full instructions as well as a 1-minute practice trial were administered prior to Session 1 in order to minimalize verbalization during the delay. The spot-the-difference task was employed for two key reasons: firstly, it introduced new meaningful material and was cognitively demanding, thereby hampering word list consolidation [1]–[4], [6]. Secondly, it was non-verbal and highly unlike the word lists, thereby minimising potential interference at retrieval between word list memories and filler task memories [1], [2]. That is, the visual spot-the-difference task allowed us to examine the effect of sensory stimulation condition on word list consolidation specifically, without the potential confound of retrieval interference.

>Participants in the minimal sensory stimulation group were instructed to rest quietly in a darkened testing room while the experimenter went to ‘organize the next part of the study’ [2], [3]. To ensure minimal sensory stimulation, all equipment was turned off, and participants had no access to mobile phones, newspapers, etc.

What's interesting is that the additional cognitive task really wasn't that demanding, just pointing out two differences between laptops 30 times. That's not *so* dissimilar to making a comment on Reddit for 10 minutes, organizing your room for 10 minutes, etc. What this points to is the idea that you need rest not only *before* doing a cognitively-demanding task, but *immediately* afterward -- a 40% increase in material retrieval is absolutely insane. Even if commenting on Reddit is only 25% as cognitively demanding as pointing to differences in laptops, that's still a whopping 10% difference which is a full letter grade. 

I suppose to put this into practice you would need to take a 5 to 15 minute wakeful resting period after each chunk or subject that you are learning. So instead of stringing together programming / learning a language, you would pause for 10 minutes after each activity. You should also probably not text or move onto another task, unless the task is something that is similarly restful like walking.

What are some other psychological studies that people should know here?",2019-01-14 18:41:36
Since losing my job due to health issues 2 years ago I started to create a Health tracking app to help spot patterns between e.g. Mood/Symptoms and Meds/Supplements. I finally released a Free BETA version recently and I thought you might be interested to hear about it.,1135,gx7eqe,https://i.redd.it/9rqp2p9fm3351.png,213,1591402046.0,,2020-06-05 20:07:26
"UPDATE: I've crawled the entire PubMed database and collected all available literature on nootropics done in humans, here are the results (Human Nootropics Index 2.0)",1110,j2bq25,https://www.reddit.com/r/Nootropics/comments/j2bq25/update_ive_crawled_the_entire_pubmed_database_and/,150,1601454418.0,"Website: [https://humannootropicsindex.com](https://humannootropicsindex.com/)

Support the project on Patreon: [https://www.patreon.com/humannootropicsindex](https://www.patreon.com/humannootropicsindex)

*For the last three months I've been working on a project I call the HNT (Human Nootropics Index). This project/website crawls PubMed on an hourly basis and gathers all available nootropics literature done in humans. The main motive for this project is to organize and put an end to the scatteredness of nootropics-literature and the lack of a single place with only human studies.*

**Since my** [first post (ver. 1.0)](https://www.reddit.com/r/Nootropics/comments/imk1s0/ive_crawled_the_entire_pubmed_database_and/) **4 weeks ago I have been fixing and dealing with the issues and constructive criticism the project received on the first post.  I think I've done a satisfactory job in improving these aspects and hopefully these adjustments will be well received. Below is a rundown of the changes made:**

* Added many more studies
* Added an SSL-certificate
* Added patients and infants as a demographic
* Improved the design
* Less whitespace
* Added some categories
* Added the option for people to comment, add studies themselves, vote
* Added trending studies-functionality
* Improved the search-function and made it not lag on phones.
* Made the website mobile friendly
* Increased the crawler-frequency to hourly from previously weekly",2020-09-30 04:26:58
How to get a scientific paper for free,1044,8x8vct,https://i.redd.it/jaom6bitms811.jpg,60,1531145713.0,,2018-07-09 10:15:13
"People who learn how to learn can outperform those with very high IQs. Much of it comes down to “metacognition,” paying close attention to how you are thinking, writes Center for American Progress’ Ulrich Boser.",1014,8iy75b,https://www.researchgate.net/publication/285864991_Giftedness_Predicting_the_speed_of_expertise_acquisition_by_intellectual_ability_and_metacognitive_skillfulness_of_novices,112,1526180988.0,,2018-05-12 23:09:48
Any thoughts on this? What could replace alcohol?,939,d43hkn,https://i.redd.it/loylosjkdjm31.jpg,581,1568485515.0,,2019-09-14 14:25:15
Less than one week left to get 3000 signatures to put psilocybin (the active ingredient in magic mushrooms) on the Oregon November ballot. This would allow it to be used to treat anxiety and depression at licensed facilities. Lets not let this pass us by!!,930,hgfi34,https://www.reddit.com/r/Nootropics/comments/hgfi34/less_than_one_week_left_to_get_3000_signatures_to/,47,1593232595.0," [https://yesonip34.org/](https://yesonip34.org/)

[Oregon Psilocybin Program Initiative (2020)](https://ballotpedia.org/Oregon_Psilocybin_Program_Initiative_(2020))

If you don't wish to send your personal information online, you can download the petition to sign [here](https://drive.google.com/file/d/1Kv-By6nla4QN59-UzEmbU7tYFaV7FwKu/view).   But either way, a physical copy needs to be signed and and mailed in.   It is important to include your Oregon voter address at the bottom,  that's how the state verifies voter registration.  And don't forget read  the instructions section and sign both sections, otherwise it will be  considered invalid.  Sorry, but only Oregon voters.

If you don't have a printer, email [info@yesonip34.org](mailto:info@yesonip34.org) and they'll mail you a physical copy with a prepaid envelope.

Also, for decriminalization of all psychoactive plant medicines in Portland, please read [this](https://i.redd.it/bob5gopr6t451.png).",2020-06-27 00:36:35
"""Over the past 2.5 years, Google has decreased traffic to Examine.com by roughly 90%"" (Examine.com is not the only online informational website affected. It seems like a big problem if Google is making it hard for supplement newbies to find decent info.)",861,cpg1ha,https://examine.com/nutrition/google-update-july-2019/,144,1565661725.0,,2019-08-12 22:02:05
"Hopkins researchers recommend reclassifying psilocybin, the drug in 'magic' mushrooms, from schedule I to schedule IV",839,9jpmxr,https://hub.jhu.edu/2018/09/26/psilocybin-scheduling-magic-mushrooms/?utm_source=Hub+-+Synced+List&utm_campaign=d446137fc4-EMAIL_CAMPAIGN_2018_09_26_07_29&utm_medium=email&utm_term=0_3aa22d10c7-d446137fc4-69648413,161,1538189167.0,,2018-09-28 22:46:07
Installing air filters in classrooms has surprisingly large educational benefits - a few months of air filtering dramatically improves test scores,785,em0rel,https://www.vox.com/2020/1/8/21051869/indoor-air-pollution-student-achievement,91,1578554410.0,,2020-01-09 02:20:10
Got a threatening message from Cortex Labs - bizarre experience.,726,82q1b6,https://www.reddit.com/r/Nootropics/comments/82q1b6/got_a_threatening_message_from_cortex_labs/,185,1520472602.0,"I rated Cortex Labs on Facebook without leaving a detailed review. Nearly instantaneous, they not only replied to this review, but also sent me a threatening private message:

""You're going to want to remove that review, before we subpoena FB to find the IP address and location of the account your using. You are not a customer of ours, and are posting negative reviews for personal reasons. You have 36 hours to remove this review.""

I then edited my review (and lowered my rating from 2 stars to 1) and added in the details of the private message they sent me. 

Their reply? 

""And that wasn't a threat. It's a promise. Our attorneys don't let people get away with fraudulent public slandering.""

Which is rather strange, considering my initial rating didn't contain a single written word, and the edit only mentioned the threatening message I received from them - so I'm not sure how that could be considered ""slanderous"" in any way.

I told my friend about this experience who then also took to the comments, and we were swiftly accused of being the same person.

Over the next hour, 5 5 star ratings mysteriously appear, raising their average rating again (some having a suspiciously similar writing style). 

Unfortunately, I have since found out [this isn't the first time Cortex Labs has acted very unprofessionally](https://imgur.com/a/qb2rf) and from these sudden 5 star ratings appearing, this also now adds some serious shadiness as well.

Needless to say, this was bizarre. Has anyone else had a similar experience with them?


/edit: It is interesting to review this post a few hours later. Ryan came here with a fake account himself, spewing insults while presenting himself as a personal ""friend"" (the same thing he actually accused others of). He has also now disabled the review section on his Facebook page completely, purging it of ALL reviews in an attempt to hide his poor behavior. 

His product (Cortex Nootropic Stack) can still be reviewed on Amazon.

I also found this [hilarious review](https://www.naturalnootropic.com/cortex-generation-1-review/) where he also felt the need to to vigorously engage with the author in the comments.

My advice to Ryan: Learn some customer relation skills, or even better: Just learn how to be a better person.

/edit 2:
It seems Ryan wasn't content just posting in this thread posing as a friend.

Now he's fighting back, and he has some choice words for users in this subreddit.

He talks about it in his [newest video](https://youtu.be/qnuJSQClxi8?t=36s), essentially calling everyone a loser (with a bad job).

He also mentions this Conor McGregor quote:

>Winners focus on winning, losers focus on winners.

The irony of saying this while talking about other people (reddit users) seems to have been lost on him.

Unfortunately, it seems he didn't heed my advice about learning some customer relation skills or just being a better person.

All this over a wordless 2 star review that made him threaten me and claim my review was fake, because I didn't order this product from him. I guess he never realized I [could've just ordered it from Amazon](https://www.amazon.com/Cortex-Nootropic-Stack-Performance-Monophospate/dp/B01N26XS8D/ref=cm_cr_arp_d_product_top?ie=UTF8), or tried some from a friend?

At this point, I really do feel a little sorry for him - in his own words, he's supposedly a vet who was (or is still) suffering from PTSD. Of course that doesn't excuse his behavior, but I hope he realizes that acting the way he does certainly won't help him OR his business succeed.",2018-03-07 20:30:02
FDA Approves Intranasal Ketamine for depression.,731,axwzh6,https://www.washingtonpost.com/health/2019/03/06/biggest-advance-depression-years-fda-approves-novel-treatment-hardest-cases/?noredirect=on&utm_term=.88aaa4098eb2,178,1551893471.0,,2019-03-06 12:31:11
Rhonda Patrick here. I've just released my most in-depth video EVER (months in the making) on a profoundly important plant compound: sulforaphane. I believe sulforaphane holds promise as a nootropic because of its promising effects on the brain and behavior. Skip to 26:30 for brain section.,710,5hz55y,https://youtu.be/zz4YVJ4aRfg,120,1481604608.0,,2016-12-12 23:50:08
